{
  "tool_name": "billing.query_statement",
  "operation": "execute",
  "status": "completed",
  "summary": "账单周期 2026-04 总金额 1288.32 CNY。",
  "result": {
    "billing_cycle": "2026-04",
    "range": "this_month",
    "total_amount": 1288.32,
    "currency": "CNY",
    "statement_nos": [
      "stmt_2026_04_001"
    ]
  },
  "citations": [
    "billing://statement"
  ],
  "success": true,
  "code": 0,
  "message": "ok",
  "data": {
    "billing_cycle": "2026-04",
    "range": "this_month",
    "total_amount": 1288.32,
    "currency": "CNY",
    "statement_nos": [
      "stmt_2026_04_001"
    ]
  },
  "audit_tags": [
    "finance-order",
    "execute",
    "query"
  ],
  "session_context_patch": {
    "attributes": {
      "statement_no": "stmt_2026_04_001",
      "billing_cycle": "2026-04"
    }
  },
  "retryable": false,
  "cache_ttl_seconds": 30,
  "provider": "business-tools",
  "error_detail": {},
  "compensation": null,
  "idempotency_key": "tool-biz-contract-success-1"
}
